{
  "schemaVersion": 1,
  "kind": "r5-p0-assertion-gap-ledger",
  "revision": "2026-10-15.1",
  "observedOn": "2026-10-15",
  "milestone": "Current EOS R5 full-RAW native read/preview slice and its bounded read-only date-admission observations; no new feature or mutation gate.",
  "evidenceSources": [
    {
      "id": "EV-001",
      "path": "docs/fixture-plan/case-plan.v1.json",
      "class": "requirements",
      "scope": "Original 29-family plan; original priorities are retained, not current execution results."
    },
    {
      "id": "EV-002",
      "path": "docs/reader/validation.md",
      "class": "published-private-summary",
      "scope": "Already published #0020 read/preview comparison for the declared private stratum; not broader camera coverage."
    },
    {
      "id": "EV-003",
      "path": "tests/reader_contract.rs",
      "class": "native-authored",
      "scope": "Root authored reader/extraction/CLI bounds and profile-negative tests; no camera photographs."
    },
    {
      "id": "EV-004",
      "path": "tests/admission_contract.rs",
      "class": "native-authored",
      "scope": "Root authored date/alias/indicator and JPEG framing/resource-bound tests; refusal observations do not admit writes."
    },
    {
      "id": "EV-005",
      "path": "docs/write-safety/write-admission.md",
      "class": "published-private-summary",
      "scope": "Previously public #0027 bounded admission/refusal observations and limits, not positive writer support."
    },
    {
      "id": "EV-006",
      "path": "docs/legacy-compatibility/native-read-json.md",
      "class": "native-authored",
      "scope": "Published #0053 actual authored CLI JSON/schema/semantic coverage, not expanded input-format support."
    },
    {
      "id": "EV-007",
      "path": "tests/source_binding.rs",
      "class": "native-authored",
      "scope": "Root source-content revalidation and stale/changed plan controls; no mutation authority."
    },
    {
      "id": "EV-008",
      "path": "docs/sidecars/xmp-component.md",
      "class": "research-authored",
      "scope": "Authored bounded XMP component research; not root XML/sidecar parser adoption."
    },
    {
      "id": "EV-009",
      "path": "docs/sidecars/date-preservation.md",
      "class": "research-authored",
      "scope": "Authored one-date XMP no-op/lexical mechanism; no production sidecar writer or storage profile."
    },
    {
      "id": "EV-010",
      "path": "docs/write-safety/cr3-reference-effects.md",
      "class": "method-only",
      "scope": "Public #0099 method only. New camera outcomes and denominators are private and unavailable to this public ledger."
    },
    {
      "id": "EV-011",
      "path": "docs/write-safety/cr3-rewrite-attribution.md",
      "class": "method-only",
      "scope": "Public #0102 read-only attribution method only. No private findings or camera coverage is imported here."
    },
    {
      "id": "EV-012",
      "path": "docs/provenance/README.md",
      "class": "requirements",
      "scope": "Use-specific rights, privacy, phases, publication and redistribution obligations."
    },
    {
      "id": "EV-013",
      "path": "docs/write-safety/new-output-preservation.md",
      "class": "published-private-summary",
      "scope": "Previously public #0021 fixed-candidate and LibRaw unprocessed RAW comparisons; not an independent embedded-JPEG decoder."
    },
    {
      "id": "EV-014",
      "path": "docs/reader/README.md",
      "class": "requirements",
      "scope": "Implemented finite field/profile/budget contract and explicit current exclusions."
    },
    {
      "id": "EV-015",
      "path": "docs/write-safety/power-test-policy.md",
      "class": "requirements",
      "scope": "Accepted best-effort disposable-VM-off ceiling; no physical power testing or hardware prerequisite."
    },
    {
      "id": "EV-016",
      "path": "docs/sidecars/pairing.md",
      "class": "native-authored",
      "scope": "Native explicit read-only pairing; not XMP content resolution or filesystem organization."
    },
    {
      "id": "EV-017",
      "path": "docs/fixture-plan/validation.md",
      "class": "research-authored",
      "scope": "Historical model/schema/provenance controls were synthetic, not executed camera cases."
    },
    {
      "id": "EV-018",
      "path": "docs/corpus-baseline/README.md",
      "class": "published-private-summary",
      "scope": "Previously public reference-only acquisition observations; not current native or independent-validator coverage."
    }
  ],
  "families": [
    {
      "id": "FXP-001",
      "sourcePriority": "P0",
      "disposition": "partial-current-slice",
      "assertionRefs": [],
      "rationale": "Declared full-RAW recognition and misleading-extension/no-effect evidence exist for the current slice. This is not all layouts/settings or tamper-proof camera identity.",
      "evidenceRefs": [
        "EV-002",
        "EV-003",
        "EV-014"
      ]
    },
    {
      "id": "FXP-002",
      "sourcePriority": "P1",
      "disposition": "deferred-non-p0",
      "assertionRefs": [],
      "rationale": "Original P1 capture/firmware/lens variation remains targeted future scope. No additional ISO-only photo stratum is invented as a first-read P0 gate.",
      "evidenceRefs": [
        "EV-001",
        "EV-002"
      ]
    },
    {
      "id": "FXP-003",
      "sourcePriority": "P0",
      "disposition": "active-gap",
      "assertionRefs": [
        "P0A-003"
      ],
      "rationale": "Distinct origins already survive; the selected missing assertion is one deliberately disagreeing CMT2/CTMD pair.",
      "evidenceRefs": [
        "EV-002",
        "EV-003",
        "EV-006"
      ]
    },
    {
      "id": "FXP-004",
      "sourcePriority": "P0",
      "disposition": "active-gap",
      "assertionRefs": [
        "P0A-003"
      ],
      "rationale": "Exact supported integer/rational/string and invalid-state serialization exists; the selected delta is preserving disagreeing source-qualified exact values. Generic model types do not expand the parser.",
      "evidenceRefs": [
        "EV-003",
        "EV-006"
      ]
    },
    {
      "id": "FXP-005",
      "sourcePriority": "P0",
      "disposition": "active-gap",
      "assertionRefs": [
        "P0A-004"
      ],
      "rationale": "Select only current stored-string host-zone invariance. Broader container integer-time conversion is unimplemented and must not be simulated by extra fixtures.",
      "evidenceRefs": [
        "EV-004",
        "EV-014"
      ]
    },
    {
      "id": "FXP-006",
      "sourcePriority": "P1",
      "disposition": "deferred-non-p0",
      "assertionRefs": [],
      "rationale": "Original P1 GPS interpretation is outside this root decoded slice. Opaque GPS bytes or partial reads never establish absence of location information.",
      "evidenceRefs": [
        "EV-001",
        "EV-014"
      ]
    },
    {
      "id": "FXP-007",
      "sourcePriority": "P0",
      "disposition": "active-gap",
      "assertionRefs": [
        "P0A-002"
      ],
      "rationale": "Current stored-byte extraction/reference equality is observed; JPEG entropy validity is not promised by extraction. The selected independent decoder need is staged future preservation/usability evidence under FXP-022, not a new read gate. Nested metadata interpretation remains unsupported.",
      "evidenceRefs": [
        "EV-002",
        "EV-013",
        "EV-014"
      ]
    },
    {
      "id": "FXP-008",
      "sourcePriority": "P0",
      "disposition": "implementation-prerequisite",
      "assertionRefs": [],
      "rationale": "Original P0 embedded-XMP/sidecar conflict semantics remain. Native explicit pairing and authored XMP component/mapping research are not root XMP parsing or conflict resolution; implementation comes before an acquisition-only task.",
      "evidenceRefs": [
        "EV-008",
        "EV-009",
        "EV-016"
      ]
    },
    {
      "id": "FXP-009",
      "sourcePriority": "P0",
      "disposition": "implementation-prerequisite",
      "assertionRefs": [],
      "rationale": "Original P0 XMP typed-shape requirement remains unfulfilled by a root parser. Research-authored XML/component evidence does not qualify root or real-camera XMP coverage.",
      "evidenceRefs": [
        "EV-008",
        "EV-009"
      ]
    },
    {
      "id": "FXP-010",
      "sourcePriority": "P0",
      "disposition": "active-gap",
      "assertionRefs": [
        "P0A-001",
        "P0A-005"
      ],
      "rationale": "Keep existing malformed/bounds/fuzz controls; add two finite named assertions rather than repeating all variants or labeling every fuzz position a family.",
      "evidenceRefs": [
        "EV-003",
        "EV-004"
      ]
    },
    {
      "id": "FXP-011",
      "sourcePriority": "P0",
      "disposition": "partial-current-slice",
      "assertionRefs": [],
      "rationale": "Authored camera/mode/encoding/external-reference refusals cover declared recognition limits. Unsupported real variants are not positive coverage; CRX/model fields remain declarations, not authenticated identity.",
      "evidenceRefs": [
        "EV-003",
        "EV-014"
      ]
    },
    {
      "id": "FXP-012",
      "sourcePriority": "P0",
      "disposition": "active-gap",
      "assertionRefs": [
        "P0A-005"
      ],
      "rationale": "Select the published cross-resource marker counter. Other current parser bounds already have controls; hard native I/O deadlines, OS quotas and richer cancellation are not current implemented promises.",
      "evidenceRefs": [
        "EV-003",
        "EV-004",
        "EV-014"
      ]
    },
    {
      "id": "FXP-013",
      "sourcePriority": "P0",
      "disposition": "partial-current-slice",
      "assertionRefs": [],